<?xml version="1.0" encoding="ISO-8859-1" standalone="yes"?>
<experiment xmlns:xsi="http://www.w3.org/2001/XMLSchema-instance"
            xsi:noNamespaceSchemaLocation="http://eule.mi.fu-berlin.de/tbc/dtd/DEScript.xsd">
    <general>
        <name>opnex meeting - 01</name>
        <description></description>
        <start_time>2009-11-06 15:54:22</start_time>
        <duration>0</duration>
        <iterations>1</iterations>
        <iteration_pause>0</iteration_pause>
        <sample_interval>60</sample_interval>
        <restart_nodes>false</restart_nodes>
        <lock_testbed>false</lock_testbed>
        <!--
            <restart_all_nodes>false</restart_all_nodes>
            <restart_exp_nodes>false</restart_exp_nodes>
            -->
        <groups>
            <group>
                <name>All</name>
                <role>Server</role>
                <members>
                    <node id="t9-150"></node>
                    <node id="t9-149"></node>
                    <node id="t9-105"></node>
                    <node id="t9-146"></node>
                    <node id="t9-154"></node>
                    <node id="t9-155"></node>
                    <node id="t9-162"></node>
                    <node id="t9-163"></node>
                    <node id="t9-158"></node>
                    <node id="t9-169"></node>
                    <node id="t9-108"></node>
                    <node id="t9-113"></node>
                    <node id="t9-117"></node>
                    <node id="t9-165"></node>
                    <node id="t9-134"></node>
                    <node id="t9-124"></node>
                    <node id="t9-136"></node>
                    <node id="t9-166"></node>
                    <node id="t9-137"></node>
                </members>
            </group>
            <group>
                <name>iperf server</name>
                <role>Server</role>
                <members>
                    <node id="t9-150"></node>
                </members>
            </group>
            <group>
                <name>iperf-client</name>
                <role>Client</role>
                <members>
                    <node id="t9-149"></node>
                </members>
            </group>
        </groups>
        <files></files>
    </general>

    <actions>

        <action_block id="0" execution_mode="2"> <!-- This is the setup / preparation block -->
            <action id="0">
                <command>sudo ifup wlan0</command>
                <group>All</group>
                <start_time>0</start_time>
                <duration>0</duration>
            </action>
            <action id="1">
                <command>sudo iwconfig wlan chan 13</command>
                <group>All</group>
                <start_time>0</start_time>
                <duration>0</duration>
            </action>
            <action id="2">
                <command>sudo /etc/init.d/olsrd restart</command>
                <group>All</group>
                <start_time>0</start_time>
                <duration>0</duration>
            </action>
        </action_block>

        <action_block id="1" execution_mode="3">
            <action id="1">
                <command>iperf -s</command>
                <group>iperf server</group>
                <start_time>0</start_time>
                <duration>120</duration>
                <evaluation_script xsi:nil="false">1</evaluation_script>
                <evaluation_parameter xsi:nil="false">opnex-meeting-server</evaluation_parameter>
            </action>
            <action id="2">
                <command>iperf -c 192.168.18.1 -t60</command>
                <group>iperf-client</group>
                <start_time>5</start_time>
                <duration>70</duration>
                <evaluation_script xsi:nil="false">1</evaluation_script>
                <evaluation_parameter xsi:nil="false">opnex-meeting-client</evaluation_parameter>
            </action>
        </action_block>
    </actions>
</experiment>
